{
  "schema_version": "1.0",
  "provenance": {
    "mock": true,
    "fictional": true,
    "generator": "deterministic-engine",
    "generator_version": "0.2.0",
    "scenario_id": "edge-money-extremes",
    "seed": 7
  },
  "matter": {
    "matter_id": "MMC-2026-538485",
    "practice_area": "business",
    "title": "Casco Bay Marine Infrastructure Group, Inc. v. Penobscot Narrows Terminal Authority LLC (accounting reconciliation)",
    "jurisdiction": {
      "state": "ME",
      "county": "Cumberland",
      "court_location": "Portland",
      "court_type": "Superior Court (Business and Consumer Docket)"
    },
    "case_type": "contract_dispute",
    "filing_date": "2026-03-14",
    "status": "intake",
    "summary": "Casco Bay Marine Infrastructure Group, Inc. sues Penobscot Narrows Terminal Authority LLC over the final project reconciliation, payment applications 1 through 47 on a $123456789.1 marine terminal contract: $6172839.46 of retainage, a $-2500.75 setoff, and a ledger that closes one cent out of balance.",
    "docket_number": "CUM-BUS-2026-171"
  },
  "parties": {
    "plaintiff": {
      "entity_type": "organization",
      "organization_name": "Casco Bay Marine Infrastructure Group, Inc.",
      "full_name": "Casco Bay Marine Infrastructure Group, Inc.",
      "address": "400 Commercial Street, Pier 2",
      "city": "Portland",
      "state": "ME",
      "zip": "04101",
      "phone": "(207) 555-0154",
      "role": "Plaintiff (prime contractor)"
    },
    "defendant": {
      "entity_type": "organization",
      "organization_name": "Penobscot Narrows Terminal Authority LLC",
      "full_name": "Penobscot Narrows Terminal Authority LLC",
      "address": "2 Waterfront Way",
      "city": "Bucksport",
      "state": "ME",
      "zip": "04416",
      "phone": "(207) 555-0187",
      "role": "Defendant (project owner)"
    },
    "attorney": {
      "entity_type": "person",
      "first_name": "Olivia",
      "middle_name": "B",
      "last_name": "Ellsworth",
      "full_name": "Olivia B. Ellsworth",
      "role": "Attorney for the client",
      "address": "39 Meadowbrook Drive",
      "city": "Yarmouth",
      "state": "ME",
      "zip": "04047",
      "phone": "(207) 555-0174",
      "email": "olivia.ellsworth@example.com",
      "date_of_birth": "1969-04-20",
      "ssn_last4": "0614",
      "bar_number": "2408",
      "organization_name": "Kingsley & Associates"
    },
    "client": {
      "entity_type": "organization",
      "organization_name": "Casco Bay Marine Infrastructure Group, Inc.",
      "full_name": "Casco Bay Marine Infrastructure Group, Inc.",
      "address": "400 Commercial Street, Pier 2",
      "city": "Portland",
      "state": "ME",
      "zip": "04101",
      "phone": "(207) 555-0154",
      "role": "Plaintiff (prime contractor)"
    }
  },
  "fact_pattern": {
    "summary": "Casco Bay Marine Infrastructure Group, Inc. sues Penobscot Narrows Terminal Authority LLC over the final project reconciliation, payment applications 1 through 47 on a $123456789.1 marine terminal contract: $6172839.46 of retainage, a $-2500.75 setoff, and a ledger that closes one cent out of balance.",
    "narrative": "Casco Bay Marine Infrastructure Group, Inc. completed a marine terminal for Penobscot Narrows Terminal Authority LLC under a contract valued at $123456789.1. At final project reconciliation, payment applications 1 through 47, the owner holds $6172839.46 in retainage and asserts a liquidated-damages setoff of $-2500.75 (a negative adjustment on the payment ledger).\n\nThe reconciliation also carries a change order priced at $0 (scope swap, no price change), a prompt-payment interest item of $1234.565 whose half-cent must round somewhere, and — after 47 payment applications — a ledger that closes $0.01 out of balance. Neither side's accounting software agrees on where the penny went.\n\nCounsel Olivia B. Ellsworth of Kingsley & Associates will plead breach of contract and violation of Maine's prompt-payment act to release the retainage.",
    "undisputed_facts": [
      "The contract value is $123456789.1.",
      "The owner holds $6172839.46 of retainage after final completion."
    ],
    "disputed_facts": [
      "Whether the $-2500.75 liquidated-damages setoff is enforceable.",
      "The rounding of the $1234.565 interest item and the unreconciled $0.01."
    ]
  },
  "intake_interview": {
    "interviewer": "Construction Counsel",
    "interviewee_role": "plaintiff",
    "date": "2026-03-14",
    "exchanges": [
      {
        "topic": "Retainage",
        "question": "What is actually being held?",
        "answer": "$6172839.46 — five percent of $123456789.1 — months after final completion."
      },
      {
        "topic": "Setoff",
        "question": "What is their justification?",
        "answer": "A liquidated-damages backcharge of $-2500.75; we say the delay was owner-caused."
      },
      {
        "topic": "The penny",
        "question": "Seriously, one cent?",
        "answer": "Forty-seven pay apps and the ledgers close $0.01 apart. Their system rounds each line; ours rounds the total."
      }
    ]
  },
  "issues": [
    {
      "issue": "Release of retainage after final completion",
      "category": "contract",
      "governing_law": "10 M.R.S. §§ 1111-1120 (prompt payment)",
      "sub_questions": [
        "Is retention past final completion a prompt-payment violation?",
        "Does statutory interest accrue?"
      ],
      "strength": "strong",
      "id": "iss1"
    },
    {
      "issue": "Enforceability of the liquidated-damages setoff",
      "category": "contract",
      "governing_law": "Common law; contract article 9",
      "sub_questions": [
        "Is the per-diem a penalty?",
        "Was the delay owner-caused?"
      ],
      "strength": "moderate",
      "id": "iss2"
    }
  ],
  "evidence": [
    {
      "title": "Owner's setoff notice",
      "type": "correspondence",
      "party": "defendant",
      "description": "The liquidated-damages backcharge of $-2500.75.",
      "id": "ev1"
    },
    {
      "title": "Payment application ledger",
      "type": "financial_record",
      "party": "plaintiff",
      "description": "All 47 payment applications and the one-cent reconciliation gap.",
      "id": "ev2"
    }
  ],
  "financials": {
    "currency": "USD",
    "amounts": [
      {
        "label": "Retainage withheld",
        "amount": 6172839.46,
        "basis": "Five percent retention."
      },
      {
        "label": "Prompt-payment interest item",
        "amount": 1234.565,
        "basis": "Half-cent amount that must round."
      },
      {
        "label": "Contract value",
        "amount": 123456789.1,
        "basis": "Nine-figure contract price with cents."
      },
      {
        "label": "Liquidated-damages setoff (owner backcharge)",
        "amount": -2500.75,
        "basis": "Negative adjustment asserted by the owner."
      },
      {
        "label": "Unreconciled ledger difference",
        "amount": 0.01,
        "basis": "One cent of drift across 47 payment applications."
      },
      {
        "label": "Zero-dollar change order",
        "amount": 0,
        "basis": "Scope swap; no price change."
      }
    ],
    "total_claimed": 129628362.39
  },
  "facts": {
    "contract_value": 123456789.1,
    "retainage_withheld": 6172839.46,
    "disputed_penny": 0.01,
    "liquidated_damages_setoff": -2500.75,
    "zero_dollar_change_order": 0,
    "half_cent_interest_item": 1234.565,
    "reconciliation_period": "final project reconciliation, payment applications 1 through 47"
  }
}
